asset_id,doc_id,year,filing_type,member_first_name,member_last_name,state_district,schedule,asset_name,asset_type,owner,trust_wrapper,value_low,value_high,income_type,income_amount,page_idx,raw_row_text,extracted_by,_source_url
183,8220779,2023,A,Rohit,Khanna,CA17,A_assets,Resilience Fund IV LP,PTN,DC,,1000001.0,5000000.0,PTN INC,"$1,001-$2,500",2,"Resilience Fund IV LP DC $1,000,001-$5,000,000 PTN $1,001-$2,500",gemini-3.1-flash-lite-preview,https://disclosures-clerk.house.gov/PublicDisclosure
184,8220779,2023,A,Rohit,Khanna,CA17,A_assets,2010 Grandchildren Trust,PTN,DC,,1000001.0,5000000.0,PTN INC,"$1,001-$2,500",2,"2010 Grandchildren Trust DC $1,000,001-$5,000,000 PTN $1,001-$2,500",gemini-3.1-flash-lite-preview,https://disclosures-clerk.house.gov/PublicDisclosure
185,8220779,2023,A,Rohit,Khanna,CA17,A_assets,"Kayne Anderson Energy Fund 6, LP",PTN,DC,,1000001.0,5000000.0,PTN INC,"$1,001-$2,500",2,"Kayne Anderson Energy Fund 6, LP DC $1,000,001-$5,000,000 PTN $1,001-$2,500",gemini-3.1-flash-lite-preview,https://disclosures-clerk.house.gov/PublicDisclosure
186,8220779,2023,A,Rohit,Khanna,CA17,A_assets,ARECO LP,PTN,DC,,1000001.0,5000000.0,PTN INC,"$1,001-$2,500",2,"ARECO LP DC $1,000,001-$5,000,000 PTN $1,001-$2,500",gemini-3.1-flash-lite-preview,https://disclosures-clerk.house.gov/PublicDisclosure
187,8220779,2023,A,Rohit,Khanna,CA17,A_assets,"MAI Capital Income and Growth Fund III, LP",PTN,DC,,1000001.0,5000000.0,PTN INC,"$1,001-$2,500",2,"MAI Capital Income and Growth Fund III, LP DC $1,000,001-$5,000,000 PTN $1,001-$2,500",gemini-3.1-flash-lite-preview,https://disclosures-clerk.house.gov/PublicDisclosure
188,8220779,2023,A,Rohit,Khanna,CA17,A_assets,"MAI Diversified Real Estate Income Fund, LP",PTN,DC,,1000001.0,5000000.0,PTN INC,"$1,001-$2,500",2,"MAI Diversified Real Estate Income Fund, LP DC $1,000,001-$5,000,000 PTN $1,001-$2,500",gemini-3.1-flash-lite-preview,https://disclosures-clerk.house.gov/PublicDisclosure
189,8220779,2023,A,Rohit,Khanna,CA17,A_assets,MURA Holdings,PTN,SP,,1000001.0,5000000.0,PTN INC,"$1,001-$2,500",3,"MURA Holdings SP $1,000,001-$5,000,000 PTN $1,001-$2,500",gemini-3.1-flash-lite-preview,https://disclosures-clerk.house.gov/PublicDisclosure
190,8220779,2023,A,Rohit,Khanna,CA17,A_assets,Ritu Ahuja 1994 Trust,PTN,SP,,1000001.0,5000000.0,PTN INC,"$1,001-$2,500",3,"Ritu Ahuja 1994 Trust SP $1,000,001-$5,000,000 PTN $1,001-$2,500",gemini-3.1-flash-lite-preview,https://disclosures-clerk.house.gov/PublicDisclosure
191,8220779,2023,A,Rohit,Khanna,CA17,A_assets,Azulite III Fund,PTN,DC,,1000001.0,5000000.0,PTN INC,"$1,001-$2,500",3,"Azulite III Fund DC $1,000,001-$5,000,000 PTN $1,001-$2,500",gemini-3.1-flash-lite-preview,https://disclosures-clerk.house.gov/PublicDisclosure
192,8220779,2023,A,Rohit,Khanna,CA17,A_assets,MURA Holdings,PTN,DC,,1000001.0,5000000.0,PTN INC,"$1,001-$2,500",3,"MURA Holdings DC $1,000,001-$5,000,000 PTN $1,001-$2,500",gemini-3.1-flash-lite-preview,https://disclosures-clerk.house.gov/PublicDisclosure
193,8220779,2023,A,Rohit,Khanna,CA17,A_assets,2020 Trust FBO Khanna Children,PTN,DC,,1000001.0,5000000.0,PTN INC,"$1,001-$2,500",3,"2020 Trust FBO Khanna Children DC $1,000,001-$5,000,000 PTN $1,001-$2,500",gemini-3.1-flash-lite-preview,https://disclosures-clerk.house.gov/PublicDisclosure
194,8220779,2023,A,Rohit,Khanna,CA17,A_assets,Monte and Usha Ahuja 2010 Irrev Trust FBO Grandchildren,PTN,DC,,1000001.0,5000000.0,PTN INC,"$5,001-$15,000",3,"Monte and Usha Ahuja 2010 Irrev Trust FBO Grandchildren DC $1,000,001-$5,000,000 PTN $5,001-$15,000",gemini-3.1-flash-lite-preview,https://disclosures-clerk.house.gov/PublicDisclosure
195,8220779,2023,A,Rohit,Khanna,CA17,A_assets,Growth and Emerging Markets Private Equity Managers,PTN,DC,,1000001.0,5000000.0,PTN INC,"$1,001-$2,500",3,"Growth and Emerging Markets Private Equity Managers DC $1,000,001-$5,000,000 PTN $1,001-$2,500",gemini-3.1-flash-lite-preview,https://disclosures-clerk.house.gov/PublicDisclosure
196,8220779,2023,A,Rohit,Khanna,CA17,A_assets,KKR Principal Opportunities Access,PTN,DC,,1000001.0,5000000.0,PTN INC,"$1,001-$2,500",3,"KKR Principal Opportunities Access DC $1,000,001-$5,000,000 PTN $1,001-$2,500",gemini-3.1-flash-lite-preview,https://disclosures-clerk.house.gov/PublicDisclosure
197,8220779,2023,A,Rohit,Khanna,CA17,A_assets,VINTAGE VI WEST STREET CAPITAL PARTNERS VI A,PTN,DC,,1000001.0,5000000.0,PTN INC,"$1,001-$2,500",3,"VINTAGE VI WEST STREET CAPITAL PARTNERS VI A DC $1,000,001-$5,000,000 PTN $1,001-$2,500",gemini-3.1-flash-lite-preview,https://disclosures-clerk.house.gov/PublicDisclosure
198,8220779,2023,A,Rohit,Khanna,CA17,A_assets,M&R Trust Partnership,PTN,DC,,250001.0,500000.0,PTN INC,"$1,001-$2,500",4,"M&R Trust Partnership DC $250,001-$500,000 PTN $1,001-$2,500",gemini-3.1-flash-lite-preview,https://disclosures-clerk.house.gov/PublicDisclosure
199,8220779,2023,A,Rohit,Khanna,CA17,A_assets,2020 Trust FBO Khanna Children,PTN,DC,,1000001.0,5000000.0,PTN INC,"$5,001-$15,000",4,"2020 Trust FBO Khanna Children DC $1,000,001-$5,000,000 PTN $5,001-$15,000",gemini-3.1-flash-lite-preview,https://disclosures-clerk.house.gov/PublicDisclosure
200,8220779,2023,A,Rohit,Khanna,CA17,A_assets,FIDELIS INVESTORS LP,PTN,DC,,1000001.0,5000000.0,PTN INC,"$1,001-$2,500",4,"FIDELIS INVESTORS LP DC $1,000,001-$5,000,000 PTN $1,001-$2,500",gemini-3.1-flash-lite-preview,https://disclosures-clerk.house.gov/PublicDisclosure
201,8220779,2023,A,Rohit,Khanna,CA17,A_assets,GROWTH AND EMERGING MARKETS PRIVATE EQUITY,PTN,DC,,1000001.0,5000000.0,PTN INC,"$1,001-$2,500",4,"GROWTH AND EMERGING MARKETS PRIVATE EQUITY DC $1,000,001-$5,000,000 PTN $1,001-$2,500",gemini-3.1-flash-lite-preview,https://disclosures-clerk.house.gov/PublicDisclosure
202,8220779,2023,A,Rohit,Khanna,CA17,A_assets,KKR PRINCIPAL OPPORTUNITIES ACCESS LP,PTN,DC,,1000001.0,5000000.0,PTN INC,"$1,001-$2,500",4,"KKR PRINCIPAL OPPORTUNITIES ACCESS LP DC $1,000,001-$5,000,000 PTN $1,001-$2,500",gemini-3.1-flash-lite-preview,https://disclosures-clerk.house.gov/PublicDisclosure
203,8220779,2023,A,Rohit,Khanna,CA17,A_assets,PETERSHILL II LP,PTN,DC,,1000001.0,5000000.0,PTN INC,"$1,001-$2,500",4,"PETERSHILL II LP DC $1,000,001-$5,000,000 PTN $1,001-$2,500",gemini-3.1-flash-lite-preview,https://disclosures-clerk.house.gov/PublicDisclosure
204,8221318,2024,A,Rohit,Khanna,CA17,A_assets,CORVEX DYNAMIC EQUITY SELECT LLC CLASS B SERIES 1,PTN,DC,Monte and Usha Ahuja 2010 Irrev Trust FBO Grandchildren,100001.0,250000.0,PTN INC,"$2,501-$5,000",2,DC CORVEX DYNAMIC EQUITY SELECT LLC CLASS B SERIES 1 X X,gemini-3.1-flash-lite-preview,https://disclosures-clerk.house.gov/PublicDisclosure
205,8221318,2024,A,Rohit,Khanna,CA17,A_assets,DRAGONEER OPPORTUNITIES V ACCESS LLC,PTN,DC,Monte and Usha Ahuja 2010 Irrev Trust FBO Grandchildren,1001.0,15000.0,PTN INC,"$201-$1,000",2,DC DRAGONEER OPPORTUNITIES V ACCESS LLC X X,gemini-3.1-flash-lite-preview,https://disclosures-clerk.house.gov/PublicDisclosure
206,8221318,2024,A,Rohit,Khanna,CA17,A_assets,TIGER GLOBAL CROSSOVER A ACCESS LLC CLASS A1 SERIES 1,PTN,DC,Monte and Usha Ahuja 2010 Irrev Trust FBO Grandchildren,50001.0,100000.0,PTN INC,"$5,001-$15,000",2,DC TIGER GLOBAL CROSSOVER A ACCESS LLC CLASS A1 SERIES 1 X X,gemini-3.1-flash-lite-preview,https://disclosures-clerk.house.gov/PublicDisclosure
207,8221318,2024,A,Rohit,Khanna,CA17,A_assets,VINTAGE VI WEST STREET CAPITAL PARTNERS VI ACCESS LP,PTN,DC,Monte and Usha Ahuja 2010 Irrev Trust FBO Grandchildren,100001.0,250000.0,PTN INC,,2,DC VINTAGE VI WEST STREET CAPITAL PARTNERS VI ACCESS LP X X,gemini-3.1-flash-lite-preview,https://disclosures-clerk.house.gov/PublicDisclosure
208,8221318,2024,A,Rohit,Khanna,CA17,A_assets,RESILIENCE ONESKY FUND,PTN,DC,Monte and Usha Ahuja 2010 Irrev Trust FBO Grandchildren,50001.0,100000.0,PTN INC,"$2,501-$5,000",2,DC RESILIENCE ONESKY FUND X X,gemini-3.1-flash-lite-preview,https://disclosures-clerk.house.gov/PublicDisclosure
209,8221318,2024,A,Rohit,Khanna,CA17,A_assets,DRAGONEER OPPORTUNITIES VI ACCESS LLC,PTN,DC,M & R Trust Partnership - 2020 Trust FBO Khanna Children,1001.0,15000.0,PTN INC,"$201-$1,000",2,DC DRAGONEER OPPORTUNITIES VI ACCESS LLC X X,gemini-3.1-flash-lite-preview,https://disclosures-clerk.house.gov/PublicDisclosure
210,8221318,2024,A,Rohit,Khanna,CA17,A_assets,GLOBAL LONG SHORT PARTNERS 100% OF FUNDS ASSETS IN ILLIQUID INVEST,PTN,DC,M & R Trust Partnership - 2020 Trust FBO Khanna Children,15001.0,50000.0,PTN INC,,2,DC GLOBAL LONG SHORT PARTNERS 100% OF FUNDS ASSETS IN ILLIQUID INVEST X X,gemini-3.1-flash-lite-preview,https://disclosures-clerk.house.gov/PublicDisclosure
211,8221318,2024,A,Rohit,Khanna,CA17,A_assets,MOUNT KELLETT CAPITAL PARTNERS II ACCESS LP,PTN,DC,M & R Trust Partnership - 2020 Trust FBO Khanna Children,15001.0,50000.0,PTN INC,"$1,001-$2,500",2,DC MOUNT KELLETT CAPITAL PARTNERS II ACCESS LP X X,gemini-3.1-flash-lite-preview,https://disclosures-clerk.house.gov/PublicDisclosure
212,8221318,2024,A,Rohit,Khanna,CA17,A_assets,PETERSHILL II LP,PTN,DC,M & R Trust Partnership - 2020 Trust FBO Khanna Children,50001.0,100000.0,PTN INC,"$2,501-$5,000",2,DC PETERSHILL II LP X X,gemini-3.1-flash-lite-preview,https://disclosures-clerk.house.gov/PublicDisclosure
213,8221318,2024,A,Rohit,Khanna,CA17,A_assets,TIGER GLOBAL CROSSOVER ACCESS LLC CLASS A1 SERIES 1,PTN,DC,M & R Trust Partnership - 2020 Trust FBO Khanna Children,50001.0,100000.0,PTN INC,"$5,001-$15,000",2,DC TIGER GLOBAL CROSSOVER ACCESS LLC CLASS A1 SERIES 1 X X,gemini-3.1-flash-lite-preview,https://disclosures-clerk.house.gov/PublicDisclosure
214,8221318,2024,A,Rohit,Khanna,CA17,A_assets,"BPCP SPEEDSTAR (AUTO PARTS DISTRIBUTION, WALTON HILLS, OH)",PTN,DC,ASK Partners - Monte and Usha Ahuja 2010 Irrev Trust FBO Grandchildren,50001.0,100000.0,PTN INC,"$5,001-$15,000",2,"DC BPCP SPEEDSTAR (AUTO PARTS DISTRIBUTION, WALTON HILLS, OH) X X",gemini-3.1-flash-lite-preview,https://disclosures-clerk.house.gov/PublicDisclosure
215,8221318,2024,A,Rohit,Khanna,CA17,A_assets,"KAYNE ANDERSON MEZZANINE PARTNERS (QP), L.P.",PTN,SP,Ritu Ahuja 1994 Trust,1001.0,15000.0,PTN INC,"$201-$1,000",2,"SP KAYNE ANDERSON MEZZANINE PARTNERS (QP), L.P. X X X",gemini-3.1-flash-lite-preview,https://disclosures-clerk.house.gov/PublicDisclosure
216,8221318,2024,A,Rohit,Khanna,CA17,A_assets,"KAYNE CREDIT OPPORTUNITIES FUND (QP), L.P.",PTN,DC,M & R Trust Partnership - 2020 Trust FBO Khanna Children,1001.0,15000.0,PTN INC,"$1,001-$2,500",3,"DC KAYNE CREDIT OPPORTUNITIES FUND (QP), L.P. X X X",gemini-3.1-flash-lite-preview,https://disclosures-clerk.house.gov/PublicDisclosure
217,8221318,2024,A,Rohit,Khanna,CA17,A_assets,RIVERVIEW SOF ILP (BAQ57),PTN,DC,M & R Trust Partnership - 2020 Trust FBO Khanna Children,1001.0,15000.0,PTN INC,,3,DC RIVERVIEW SOF ILP (BAQ57) X X X,gemini-3.1-flash-lite-preview,https://disclosures-clerk.house.gov/PublicDisclosure
218,8221318,2024,A,Rohit,Khanna,CA17,A_assets,"MAI CAPITAL INCOME AND GROWTH FUND V, LP",PTN,DC,ARECO LP - Monte and Usha Ahuja 2010 Irrev Trust FBO Grandchildren,1001.0,15000.0,PTN INC,"$1,001-$2,500",3,"DC MAI CAPITAL INCOME AND GROWTH FUND V, LP X X X",gemini-3.1-flash-lite-preview,https://disclosures-clerk.house.gov/PublicDisclosure
219,8221318,2024,A,Rohit,Khanna,CA17,A_assets,"MAI DIVERSIFIED REAL ESTATE INCOME FUND, LP",PTN,DC,ARECO LP - Monte and Usha Ahuja 2010 Irrev Trust FBO Grandchildren,15001.0,50000.0,PTN INC,"$2,501-$5,000",3,"DC MAI DIVERSIFIED REAL ESTATE INCOME FUND, LP X X X",gemini-3.1-flash-lite-preview,https://disclosures-clerk.house.gov/PublicDisclosure
220,8221318,2024,A,Rohit,Khanna,CA17,A_assets,"MAI CAPITAL INCOME AND GROWTH FUND VI, LP",PTN,DC,ARECO LP - Monte and Usha Ahuja 2010 Irrev Trust FBO Grandchildren,1001.0,15000.0,PTN INC,"$1,001-$2,500",3,"DC MAI CAPITAL INCOME AND GROWTH FUND VI, LP X X X",gemini-3.1-flash-lite-preview,https://disclosures-clerk.house.gov/PublicDisclosure
221,8221318,2024,A,Rohit,Khanna,CA17,A_assets,"MAI CAPITAL INCOME AND GROWTH FUND III, LP",PTN,DC,ARECO LP - 2020 Trust FBO Khanna Children,1001.0,15000.0,PTN INC,"$201-$1,000",3,"DC MAI CAPITAL INCOME AND GROWTH FUND III, LP X X X",gemini-3.1-flash-lite-preview,https://disclosures-clerk.house.gov/PublicDisclosure
222,8221318,2024,A,Rohit,Khanna,CA17,A_assets,"PCM UNISON HOLDINGS GP, LLC",PTN,SP,MURA Holdings - Ritu Ahuja 1994 Trust,50001.0,100000.0,PTN INC,,3,"SP PCM UNISON HOLDINGS GP, LLC X X X",gemini-3.1-flash-lite-preview,https://disclosures-clerk.house.gov/PublicDisclosure
223,8221318,2024,A,Rohit,Khanna,CA17,A_assets,"PCM UNISON HOLDINGS GP, LLC",PTN,DC,MURA Holdings - Monte and Usha Ahuja 2010 Irrev Trust FBO Grandchildren,1001.0,15000.0,PTN INC,"$1,001-$2,500",4,"DC PCM UNISON HOLDINGS GP, LLC X X X",gemini-3.1-flash-lite-preview,https://disclosures-clerk.house.gov/PublicDisclosure
